,pfCode,yr,period,periodDesc,aggrLevel,IsLeaf,rgCode,rgDesc,rtCode,rtTitle,rt3ISO,ptCode,ptTitle,pt3ISO,ptCode2,ptTitle2,pt3ISO2,cstCode,cstDesc,motCode,motDesc,cmdCode,cmdDescE,qtCode,qtDesc,qtAltCode,qtAltDesc,TradeQuantity,AltQuantity,NetWeight,GrossWeight,TradeValue,CIFValue,FOBValue,estCode
0,H5,2019,2019,2019,2,0,2,Export,40,Austria,AUT,384,Côte d'Ivoire,CIV,,,,,,,,02,Meat and edible meat offal,1,No Quantity,,,0,,0,,8587,,,0
1,H5,2019,2019,2019,2,0,2,Export,40,Austria,AUT,384,Côte d'Ivoire,CIV,,,,,,,,17,Sugars and sugar confectionery,1,No Quantity,,,0,,0,,6,,,4
2,H5,2019,2019,2019,2,0,2,Export,40,Austria,AUT,384,Côte d'Ivoire,CIV,,,,,,,,20,"Preparations of vegetables, fruit, nuts or other parts of plants",1,No Quantity,,,0,,0,,26721,,,0
3,H5,2019,2019,2019,2,0,2,Export,40,Austria,AUT,384,Côte d'Ivoire,CIV,,,,,,,,21,Miscellaneous edible preparations,1,No Quantity,,,0,,0,,394,,,0
4,H5,2019,2019,2019,2,0,2,Export,40,Austria,AUT,384,Côte d'Ivoire,CIV,,,,,,,,22,"Beverages, spirits and vinegar",1,No Quantity,,,0,,0,,554562,,,0
5,H5,2019,2019,2019,2,0,2,Export,40,Austria,AUT,384,Côte d'Ivoire,CIV,,,,,,,,23,"Food industries, residues and wastes thereof; prepared animal fodder",1,No Quantity,,,0,,0,,139421,,,0
6,H5,2019,2019,2019,2,0,2,Export,40,Austria,AUT,384,Côte d'Ivoire,CIV,,,,,,,,25,"Salt; sulphur; earths, stone; plastering materials, lime and cement",1,No Quantity,,,0,,0,,1449,,,0
7,H5,2019,2019,2019,2,0,2,Export,40,Austria,AUT,384,Côte d'Ivoire,CIV,,,,,,,,27,"Mineral fuels, mineral oils and products of their distillation; bituminous substances; mineral waxes",1,No Quantity,,,0,,0,,551,,,0
8,H5,2019,2019,2019,2,0,2,Export,40,Austria,AUT,384,Côte d'Ivoire,CIV,,,,,,,,28,"Inorganic chemicals; organic and inorganic compounds of precious metals; of rare earth metals, of radio-active elements and of isotopes",1,No Quantity,,,0,,0,,10984,,,4
9,H5,2019,2019,2019,2,0,2,Export,40,Austria,AUT,384,Côte d'Ivoire,CIV,,,,,,,,29,Organic chemicals,1,No Quantity,,,0,,0,,29882,,,4
10,H5,2019,2019,2019,2,0,2,Export,40,Austria,AUT,384,Côte d'Ivoire,CIV,,,,,,,,30,Pharmaceutical products,1,No Quantity,,,0,,0,,9105,,,0
11,H5,2019,2019,2019,2,0,2,Export,40,Austria,AUT,384,Côte d'Ivoire,CIV,,,,,,,,31,Fertilizers,1,No Quantity,,,0,,0,,542,,,4
12,H5,2019,2019,2019,2,0,2,Export,40,Austria,AUT,384,Côte d'Ivoire,CIV,,,,,,,,32,"Tanning or dyeing extracts; tannins and their derivatives; dyes, pigments and other colouring matter; paints, varnishes; putty, other mastics; inks",1,No Quantity,,,0,,0,,727,,,4
13,H5,2019,2019,2019,2,0,2,Export,40,Austria,AUT,384,Côte d'Ivoire,CIV,,,,,,,,33,"Essential oils and resinoids; perfumery, cosmetic or toilet preparations",1,No Quantity,,,0,,0,,5,,,4
14,H5,2019,2019,2019,2,0,2,Export,40,Austria,AUT,384,Côte d'Ivoire,CIV,,,,,,,,34,"Soap, organic surface-active agents; washing, lubricating, polishing or scouring preparations; artificial or prepared waxes, candles and similar articles, modelling pastes, dental waxes and dental preparations with a basis of plaster",1,No Quantity,,,0,,0,,7335,,,0
15,H5,2019,2019,2019,2,0,2,Export,40,Austria,AUT,384,Côte d'Ivoire,CIV,,,,,,,,35,Albuminoidal substances; modified starches; glues; enzymes,1,No Quantity,,,0,,0,,1251,,,4
16,H5,2019,2019,2019,2,0,2,Export,40,Austria,AUT,384,Côte d'Ivoire,CIV,,,,,,,,37,Photographic or cinematographic goods,1,No Quantity,,,0,,0,,4520,,,0
17,H5,2019,2019,2019,2,0,2,Export,40,Austria,AUT,384,Côte d'Ivoire,CIV,,,,,,,,38,Chemical products n.e.c.,1,No Quantity,,,0,,0,,40051,,,0
18,H5,2019,2019,2019,2,0,2,Export,40,Austria,AUT,384,Côte d'Ivoire,CIV,,,,,,,,39,Plastics and articles thereof,1,No Quantity,,,0,,0,,282455,,,4
19,H5,2019,2019,2019,2,0,2,Export,40,Austria,AUT,384,Côte d'Ivoire,CIV,,,,,,,,40,Rubber and articles thereof,1,No Quantity,,,0,,0,,32867,,,4
20,H5,2019,2019,2019,2,0,2,Export,40,Austria,AUT,384,Côte d'Ivoire,CIV,,,,,,,,42,"Articles of leather; saddlery and harness; travel goods, handbags and similar containers; articles of animal gut (other than silk-worm gut)",1,No Quantity,,,0,,0,,17869,,,4
21,H5,2019,2019,2019,2,0,2,Export,40,Austria,AUT,384,Côte d'Ivoire,CIV,,,,,,,,44,Wood and articles of wood; wood charcoal,1,No Quantity,,,0,,0,,744182,,,4
22,H5,2019,2019,2019,2,0,2,Export,40,Austria,AUT,384,Côte d'Ivoire,CIV,,,,,,,,48,"Paper and paperboard; articles of paper pulp, of paper or paperboard",1,No Quantity,,,0,,0,,940498,,,4
23,H5,2019,2019,2019,2,0,2,Export,40,Austria,AUT,384,Côte d'Ivoire,CIV,,,,,,,,49,"Printed books, newspapers, pictures and other products of the printing industry; manuscripts, typescripts and plans",1,No Quantity,,,0,,0,,6044,,,4
24,H5,2019,2019,2019,2,0,2,Export,40,Austria,AUT,384,Côte d'Ivoire,CIV,,,,,,,,52,Cotton,1,No Quantity,,,0,,0,,16992636,,,0
25,H5,2019,2019,2019,2,0,2,Export,40,Austria,AUT,384,Côte d'Ivoire,CIV,,,,,,,,55,Man-made staple fibres,1,No Quantity,,,0,,0,,108,,,0
26,H5,2019,2019,2019,2,0,2,Export,40,Austria,AUT,384,Côte d'Ivoire,CIV,,,,,,,,56,"Wadding, felt and nonwovens, special yarns; twine, cordage, ropes and cables and articles thereof",1,No Quantity,,,0,,0,,1662,,,4
27,H5,2019,2019,2019,2,0,2,Export,40,Austria,AUT,384,Côte d'Ivoire,CIV,,,,,,,,58,"Fabrics; special woven fabrics, tufted textile fabrics, lace, tapestries, trimmings, embroidery",1,No Quantity,,,0,,0,,2727,,,0
28,H5,2019,2019,2019,2,0,2,Export,40,Austria,AUT,384,Côte d'Ivoire,CIV,,,,,,,,59,"Textile fabrics; impregnated, coated, covered or laminated; textile articles of a kind suitable for industrial use",1,No Quantity,,,0,,0,,5563,,,4
29,H5,2019,2019,2019,2,0,2,Export,40,Austria,AUT,384,Côte d'Ivoire,CIV,,,,,,,,61,Apparel and clothing accessories; knitted or crocheted,1,No Quantity,,,0,,0,,80,,,4
30,H5,2019,2019,2019,2,0,2,Export,40,Austria,AUT,384,Côte d'Ivoire,CIV,,,,,,,,62,Apparel and clothing accessories; not knitted or crocheted,1,No Quantity,,,0,,0,,1251,,,0
31,H5,2019,2019,2019,2,0,2,Export,40,Austria,AUT,384,Côte d'Ivoire,CIV,,,,,,,,63,"Textiles, made up articles; sets; worn clothing and worn textile articles; rags",1,No Quantity,,,0,,0,,5938,,,4
32,H5,2019,2019,2019,2,0,2,Export,40,Austria,AUT,384,Côte d'Ivoire,CIV,,,,,,,,65,Headgear and parts thereof,1,No Quantity,,,0,,0,,1257,,,0
33,H5,2019,2019,2019,2,0,2,Export,40,Austria,AUT,384,Côte d'Ivoire,CIV,,,,,,,,68,"Stone, plaster, cement, asbestos, mica or similar materials; articles thereof",1,No Quantity,,,0,,0,,40723,,,4
34,H5,2019,2019,2019,2,0,2,Export,40,Austria,AUT,384,Côte d'Ivoire,CIV,,,,,,,,69,Ceramic products,1,No Quantity,,,0,,0,,9829,,,0
35,H5,2019,2019,2019,2,0,2,Export,40,Austria,AUT,384,Côte d'Ivoire,CIV,,,,,,,,70,Glass and glassware,1,No Quantity,,,0,,0,,27443,,,0
36,H5,2019,2019,2019,2,0,2,Export,40,Austria,AUT,384,Côte d'Ivoire,CIV,,,,,,,,72,Iron and steel,1,No Quantity,,,0,,0,,112517,,,4
37,H5,2019,2019,2019,2,0,2,Export,40,Austria,AUT,384,Côte d'Ivoire,CIV,,,,,,,,73,Iron or steel articles,1,No Quantity,,,0,,0,,436109,,,4
38,H5,2019,2019,2019,2,0,2,Export,40,Austria,AUT,384,Côte d'Ivoire,CIV,,,,,,,,74,Copper and articles thereof,1,No Quantity,,,0,,0,,161,,,4
39,H5,2019,2019,2019,2,0,2,Export,40,Austria,AUT,384,Côte d'Ivoire,CIV,,,,,,,,76,Aluminium and articles thereof,1,No Quantity,,,0,,0,,219371,,,0
40,H5,2019,2019,2019,2,0,2,Export,40,Austria,AUT,384,Côte d'Ivoire,CIV,,,,,,,,82,"Tools, implements, cutlery, spoons and forks, of base metal; parts thereof, of base metal",1,No Quantity,,,0,,0,,52425,,,0
41,H5,2019,2019,2019,2,0,2,Export,40,Austria,AUT,384,Côte d'Ivoire,CIV,,,,,,,,83,Metal; miscellaneous products of base metal,1,No Quantity,,,0,,0,,3673,,,4
42,H5,2019,2019,2019,2,0,2,Export,40,Austria,AUT,384,Côte d'Ivoire,CIV,,,,,,,,84,"Nuclear reactors, boilers, machinery and mechanical appliances; parts thereof",1,No Quantity,,,0,,0,,9732467,,,4
43,H5,2019,2019,2019,2,0,2,Export,40,Austria,AUT,384,Côte d'Ivoire,CIV,,,,,,,,85,"Electrical machinery and equipment and parts thereof; sound recorders and reproducers; television image and sound recorders and reproducers, parts and accessories of such articles",1,No Quantity,,,0,,0,,541276,,,4
44,H5,2019,2019,2019,2,0,2,Export,40,Austria,AUT,384,Côte d'Ivoire,CIV,,,,,,,,87,"Vehicles; other than railway or tramway rolling stock, and parts and accessories thereof",1,No Quantity,,,0,,0,,844289,,,0
45,H5,2019,2019,2019,2,0,2,Export,40,Austria,AUT,384,Côte d'Ivoire,CIV,,,,,,,,90,"Optical, photographic, cinematographic, measuring, checking, medical or surgical instruments and apparatus; parts and accessories",1,No Quantity,,,0,,0,,597545,,,4
46,H5,2019,2019,2019,2,0,2,Export,40,Austria,AUT,384,Côte d'Ivoire,CIV,,,,,,,,94,"Furniture; bedding, mattresses, mattress supports, cushions and similar stuffed furnishings; lamps and lighting fittings, n.e.c.; illuminated signs, illuminated name-plates and the like; prefabricated buildings",1,No Quantity,,,0,,0,,22912,,,4
47,H5,2019,2019,2019,2,0,2,Export,40,Austria,AUT,384,Côte d'Ivoire,CIV,,,,,,,,95,"Toys, games and sports requisites; parts and accessories thereof",1,No Quantity,,,0,,0,,18505,,,0
48,H5,2019,2019,2019,2,0,2,Export,40,Austria,AUT,384,Côte d'Ivoire,CIV,,,,,,,,96,Miscellaneous manufactured articles,1,No Quantity,,,0,,0,,77133,,,4
