,pfCode,yr,period,periodDesc,aggrLevel,IsLeaf,rgCode,rgDesc,rtCode,rtTitle,rt3ISO,ptCode,ptTitle,pt3ISO,ptCode2,ptTitle2,pt3ISO2,cstCode,cstDesc,motCode,motDesc,cmdCode,cmdDescE,qtCode,qtDesc,qtAltCode,qtAltDesc,TradeQuantity,AltQuantity,NetWeight,GrossWeight,TradeValue,CIFValue,FOBValue,estCode
0,H5,2019,2019,2019,2,0,2,Export,40,Austria,AUT,203,Czechia,CZE,,,,,,,,01,Animals; live,1,No Quantity,,,0,,0,,2061160,,,0
1,H5,2019,2019,2019,2,0,2,Export,40,Austria,AUT,203,Czechia,CZE,,,,,,,,02,Meat and edible meat offal,1,No Quantity,,,0,,0,,27058536,,,0
2,H5,2019,2019,2019,2,0,2,Export,40,Austria,AUT,203,Czechia,CZE,,,,,,,,03,"Fish and crustaceans, molluscs and other aquatic invertebrates",1,No Quantity,,,0,,0,,1226376,,,4
3,H5,2019,2019,2019,2,0,2,Export,40,Austria,AUT,203,Czechia,CZE,,,,,,,,04,"Dairy produce; birds' eggs; natural honey; edible products of animal origin, not elsewhere specified or included",1,No Quantity,,,0,,0,,4494758,,,0
4,H5,2019,2019,2019,2,0,2,Export,40,Austria,AUT,203,Czechia,CZE,,,,,,,,05,Animal originated products; not elsewhere specified or included,1,No Quantity,,,0,,0,,3263121,,,0
5,H5,2019,2019,2019,2,0,2,Export,40,Austria,AUT,203,Czechia,CZE,,,,,,,,06,"Trees and other plants, live; bulbs, roots and the like; cut flowers and ornamental foliage",1,No Quantity,,,0,,0,,3114120,,,4
6,H5,2019,2019,2019,2,0,2,Export,40,Austria,AUT,203,Czechia,CZE,,,,,,,,07,Vegetables and certain roots and tubers; edible,1,No Quantity,,,0,,0,,10831815,,,0
7,H5,2019,2019,2019,2,0,2,Export,40,Austria,AUT,203,Czechia,CZE,,,,,,,,08,"Fruit and nuts, edible; peel of citrus fruit or melons",1,No Quantity,,,0,,0,,7203996,,,0
8,H5,2019,2019,2019,2,0,2,Export,40,Austria,AUT,203,Czechia,CZE,,,,,,,,09,"Coffee, tea, mate and spices",1,No Quantity,,,0,,0,,9904346,,,0
9,H5,2019,2019,2019,2,0,2,Export,40,Austria,AUT,203,Czechia,CZE,,,,,,,,10,Cereals,1,No Quantity,,,0,,0,,8891802,,,0
10,H5,2019,2019,2019,2,0,2,Export,40,Austria,AUT,203,Czechia,CZE,,,,,,,,11,"Products of the milling industry; malt, starches, inulin, wheat gluten",1,No Quantity,,,0,,0,,12836509,,,0
11,H5,2019,2019,2019,2,0,2,Export,40,Austria,AUT,203,Czechia,CZE,,,,,,,,12,"Oil seeds and oleaginous fruits; miscellaneous grains, seeds and fruit, industrial or medicinal plants; straw and fodder",1,No Quantity,,,0,,0,,27708259,,,0
12,H5,2019,2019,2019,2,0,2,Export,40,Austria,AUT,203,Czechia,CZE,,,,,,,,13,"Lac; gums, resins and other vegetable saps and extracts",1,No Quantity,,,0,,0,,710107,,,0
13,H5,2019,2019,2019,2,0,2,Export,40,Austria,AUT,203,Czechia,CZE,,,,,,,,14,Vegetable plaiting materials; vegetable products not elsewhere specified or included,1,No Quantity,,,0,,0,,126731,,,0
14,H5,2019,2019,2019,2,0,2,Export,40,Austria,AUT,203,Czechia,CZE,,,,,,,,15,Animal or vegetable fats and oils and their cleavage products; prepared animal fats; animal or vegetable waxes,1,No Quantity,,,0,,0,,21117888,,,0
15,H5,2019,2019,2019,2,0,2,Export,40,Austria,AUT,203,Czechia,CZE,,,,,,,,16,"Meat, fish or crustaceans, molluscs or other aquatic invertebrates; preparations thereof",1,No Quantity,,,0,,0,,9271911,,,0
16,H5,2019,2019,2019,2,0,2,Export,40,Austria,AUT,203,Czechia,CZE,,,,,,,,17,Sugars and sugar confectionery,1,No Quantity,,,0,,0,,4964615,,,0
17,H5,2019,2019,2019,2,0,2,Export,40,Austria,AUT,203,Czechia,CZE,,,,,,,,18,Cocoa and cocoa preparations,1,No Quantity,,,0,,0,,29681007,,,0
18,H5,2019,2019,2019,2,0,2,Export,40,Austria,AUT,203,Czechia,CZE,,,,,,,,19,"Preparations of cereals, flour, starch or milk; pastrycooks' products",1,No Quantity,,,0,,0,,31443398,,,0
19,H5,2019,2019,2019,2,0,2,Export,40,Austria,AUT,203,Czechia,CZE,,,,,,,,20,"Preparations of vegetables, fruit, nuts or other parts of plants",1,No Quantity,,,0,,0,,24928020,,,4
20,H5,2019,2019,2019,2,0,2,Export,40,Austria,AUT,203,Czechia,CZE,,,,,,,,21,Miscellaneous edible preparations,1,No Quantity,,,0,,0,,29615124,,,0
21,H5,2019,2019,2019,2,0,2,Export,40,Austria,AUT,203,Czechia,CZE,,,,,,,,22,"Beverages, spirits and vinegar",1,No Quantity,,,0,,0,,36526685,,,0
22,H5,2019,2019,2019,2,0,2,Export,40,Austria,AUT,203,Czechia,CZE,,,,,,,,23,"Food industries, residues and wastes thereof; prepared animal fodder",1,No Quantity,,,0,,0,,30574778,,,4
23,H5,2019,2019,2019,2,0,2,Export,40,Austria,AUT,203,Czechia,CZE,,,,,,,,25,"Salt; sulphur; earths, stone; plastering materials, lime and cement",1,No Quantity,,,0,,0,,22024432,,,0
24,H5,2019,2019,2019,2,0,2,Export,40,Austria,AUT,203,Czechia,CZE,,,,,,,,26,"Ores, slag and ash",1,No Quantity,,,0,,0,,518446,,,0
25,H5,2019,2019,2019,2,0,2,Export,40,Austria,AUT,203,Czechia,CZE,,,,,,,,27,"Mineral fuels, mineral oils and products of their distillation; bituminous substances; mineral waxes",1,No Quantity,,,0,,0,,206938639,,,4
26,H5,2019,2019,2019,2,0,2,Export,40,Austria,AUT,203,Czechia,CZE,,,,,,,,28,"Inorganic chemicals; organic and inorganic compounds of precious metals; of rare earth metals, of radio-active elements and of isotopes",1,No Quantity,,,0,,0,,56736679,,,4
27,H5,2019,2019,2019,2,0,2,Export,40,Austria,AUT,203,Czechia,CZE,,,,,,,,29,Organic chemicals,1,No Quantity,,,0,,0,,14271217,,,4
28,H5,2019,2019,2019,2,0,2,Export,40,Austria,AUT,203,Czechia,CZE,,,,,,,,30,Pharmaceutical products,1,No Quantity,,,0,,0,,263242599,,,0
29,H5,2019,2019,2019,2,0,2,Export,40,Austria,AUT,203,Czechia,CZE,,,,,,,,31,Fertilizers,1,No Quantity,,,0,,0,,44088467,,,0
30,H5,2019,2019,2019,2,0,2,Export,40,Austria,AUT,203,Czechia,CZE,,,,,,,,32,"Tanning or dyeing extracts; tannins and their derivatives; dyes, pigments and other colouring matter; paints, varnishes; putty, other mastics; inks",1,No Quantity,,,0,,0,,60262431,,,0
31,H5,2019,2019,2019,2,0,2,Export,40,Austria,AUT,203,Czechia,CZE,,,,,,,,33,"Essential oils and resinoids; perfumery, cosmetic or toilet preparations",1,No Quantity,,,0,,0,,16467759,,,4
32,H5,2019,2019,2019,2,0,2,Export,40,Austria,AUT,203,Czechia,CZE,,,,,,,,34,"Soap, organic surface-active agents; washing, lubricating, polishing or scouring preparations; artificial or prepared waxes, candles and similar articles, modelling pastes, dental waxes and dental preparations with a basis of plaster",1,No Quantity,,,0,,0,,72481920,,,0
33,H5,2019,2019,2019,2,0,2,Export,40,Austria,AUT,203,Czechia,CZE,,,,,,,,35,Albuminoidal substances; modified starches; glues; enzymes,1,No Quantity,,,0,,0,,6414541,,,0
34,H5,2019,2019,2019,2,0,2,Export,40,Austria,AUT,203,Czechia,CZE,,,,,,,,36,Explosives; pyrotechnic products; matches; pyrophoric alloys; certain combustible preparations,1,No Quantity,,,0,,0,,1140662,,,0
35,H5,2019,2019,2019,2,0,2,Export,40,Austria,AUT,203,Czechia,CZE,,,,,,,,37,Photographic or cinematographic goods,1,No Quantity,,,0,,0,,405638,,,4
36,H5,2019,2019,2019,2,0,2,Export,40,Austria,AUT,203,Czechia,CZE,,,,,,,,38,Chemical products n.e.c.,1,No Quantity,,,0,,0,,63811065,,,4
37,H5,2019,2019,2019,2,0,2,Export,40,Austria,AUT,203,Czechia,CZE,,,,,,,,39,Plastics and articles thereof,1,No Quantity,,,0,,0,,310321668,,,0
38,H5,2019,2019,2019,2,0,2,Export,40,Austria,AUT,203,Czechia,CZE,,,,,,,,40,Rubber and articles thereof,1,No Quantity,,,0,,0,,44141900,,,0
39,H5,2019,2019,2019,2,0,2,Export,40,Austria,AUT,203,Czechia,CZE,,,,,,,,41,Raw hides and skins (other than furskins) and leather,1,No Quantity,,,0,,0,,10497160,,,0
40,H5,2019,2019,2019,2,0,2,Export,40,Austria,AUT,203,Czechia,CZE,,,,,,,,42,"Articles of leather; saddlery and harness; travel goods, handbags and similar containers; articles of animal gut (other than silk-worm gut)",1,No Quantity,,,0,,0,,14709473,,,0
41,H5,2019,2019,2019,2,0,2,Export,40,Austria,AUT,203,Czechia,CZE,,,,,,,,43,Furskins and artificial fur; manufactures thereof,1,No Quantity,,,0,,0,,238633,,,0
42,H5,2019,2019,2019,2,0,2,Export,40,Austria,AUT,203,Czechia,CZE,,,,,,,,44,Wood and articles of wood; wood charcoal,1,No Quantity,,,0,,0,,155304866,,,0
43,H5,2019,2019,2019,2,0,2,Export,40,Austria,AUT,203,Czechia,CZE,,,,,,,,45,Cork and articles of cork,1,No Quantity,,,0,,0,,549267,,,0
44,H5,2019,2019,2019,2,0,2,Export,40,Austria,AUT,203,Czechia,CZE,,,,,,,,46,"Manufactures of straw, esparto or other plaiting materials; basketware and wickerwork",1,No Quantity,,,0,,0,,285721,,,0
45,H5,2019,2019,2019,2,0,2,Export,40,Austria,AUT,203,Czechia,CZE,,,,,,,,47,Pulp of wood or other fibrous cellulosic material; recovered (waste and scrap) paper or paperboard,1,No Quantity,,,0,,0,,9788351,,,0
46,H5,2019,2019,2019,2,0,2,Export,40,Austria,AUT,203,Czechia,CZE,,,,,,,,48,"Paper and paperboard; articles of paper pulp, of paper or paperboard",1,No Quantity,,,0,,0,,200143273,,,0
47,H5,2019,2019,2019,2,0,2,Export,40,Austria,AUT,203,Czechia,CZE,,,,,,,,49,"Printed books, newspapers, pictures and other products of the printing industry; manuscripts, typescripts and plans",1,No Quantity,,,0,,0,,17307617,,,0
48,H5,2019,2019,2019,2,0,2,Export,40,Austria,AUT,203,Czechia,CZE,,,,,,,,50,Silk,1,No Quantity,,,0,,0,,39933,,,0
49,H5,2019,2019,2019,2,0,2,Export,40,Austria,AUT,203,Czechia,CZE,,,,,,,,51,"Wool, fine or coarse animal hair; horsehair yarn and woven fabric",1,No Quantity,,,0,,0,,19159109,,,0
50,H5,2019,2019,2019,2,0,2,Export,40,Austria,AUT,203,Czechia,CZE,,,,,,,,52,Cotton,1,No Quantity,,,0,,0,,7176217,,,4
51,H5,2019,2019,2019,2,0,2,Export,40,Austria,AUT,203,Czechia,CZE,,,,,,,,53,Vegetable textile fibres; paper yarn and woven fabrics of paper yarn,1,No Quantity,,,0,,0,,38014,,,0
52,H5,2019,2019,2019,2,0,2,Export,40,Austria,AUT,203,Czechia,CZE,,,,,,,,54,Man-made filaments; strip and the like of man-made textile materials,1,No Quantity,,,0,,0,,2053428,,,0
53,H5,2019,2019,2019,2,0,2,Export,40,Austria,AUT,203,Czechia,CZE,,,,,,,,55,Man-made staple fibres,1,No Quantity,,,0,,0,,20108518,,,0
54,H5,2019,2019,2019,2,0,2,Export,40,Austria,AUT,203,Czechia,CZE,,,,,,,,56,"Wadding, felt and nonwovens, special yarns; twine, cordage, ropes and cables and articles thereof",1,No Quantity,,,0,,0,,4662945,,,0
55,H5,2019,2019,2019,2,0,2,Export,40,Austria,AUT,203,Czechia,CZE,,,,,,,,57,Carpets and other textile floor coverings,1,No Quantity,,,0,,0,,9670782,,,0
56,H5,2019,2019,2019,2,0,2,Export,40,Austria,AUT,203,Czechia,CZE,,,,,,,,58,"Fabrics; special woven fabrics, tufted textile fabrics, lace, tapestries, trimmings, embroidery",1,No Quantity,,,0,,0,,4978130,,,4
57,H5,2019,2019,2019,2,0,2,Export,40,Austria,AUT,203,Czechia,CZE,,,,,,,,59,"Textile fabrics; impregnated, coated, covered or laminated; textile articles of a kind suitable for industrial use",1,No Quantity,,,0,,0,,8046835,,,0
58,H5,2019,2019,2019,2,0,2,Export,40,Austria,AUT,203,Czechia,CZE,,,,,,,,60,Fabrics; knitted or crocheted,1,No Quantity,,,0,,0,,2776335,,,0
59,H5,2019,2019,2019,2,0,2,Export,40,Austria,AUT,203,Czechia,CZE,,,,,,,,61,Apparel and clothing accessories; knitted or crocheted,1,No Quantity,,,0,,0,,90991648,,,0
60,H5,2019,2019,2019,2,0,2,Export,40,Austria,AUT,203,Czechia,CZE,,,,,,,,62,Apparel and clothing accessories; not knitted or crocheted,1,No Quantity,,,0,,0,,52549916,,,4
61,H5,2019,2019,2019,2,0,2,Export,40,Austria,AUT,203,Czechia,CZE,,,,,,,,63,"Textiles, made up articles; sets; worn clothing and worn textile articles; rags",1,No Quantity,,,0,,0,,19475618,,,0
62,H5,2019,2019,2019,2,0,2,Export,40,Austria,AUT,203,Czechia,CZE,,,,,,,,64,Footwear; gaiters and the like; parts of such articles,1,No Quantity,,,0,,0,,51980795,,,0
63,H5,2019,2019,2019,2,0,2,Export,40,Austria,AUT,203,Czechia,CZE,,,,,,,,65,Headgear and parts thereof,1,No Quantity,,,0,,0,,5063706,,,0
64,H5,2019,2019,2019,2,0,2,Export,40,Austria,AUT,203,Czechia,CZE,,,,,,,,66,"Umbrellas, sun umbrellas, walking-sticks, seat sticks, whips, riding crops; and parts thereof",1,No Quantity,,,0,,0,,7992861,,,0
65,H5,2019,2019,2019,2,0,2,Export,40,Austria,AUT,203,Czechia,CZE,,,,,,,,67,"Feathers and down, prepared; and articles made of feather or of down; artificial flowers; articles of human hair",1,No Quantity,,,0,,0,,527960,,,0
66,H5,2019,2019,2019,2,0,2,Export,40,Austria,AUT,203,Czechia,CZE,,,,,,,,68,"Stone, plaster, cement, asbestos, mica or similar materials; articles thereof",1,No Quantity,,,0,,0,,32498330,,,4
67,H5,2019,2019,2019,2,0,2,Export,40,Austria,AUT,203,Czechia,CZE,,,,,,,,69,Ceramic products,1,No Quantity,,,0,,0,,17758008,,,0
68,H5,2019,2019,2019,2,0,2,Export,40,Austria,AUT,203,Czechia,CZE,,,,,,,,70,Glass and glassware,1,No Quantity,,,0,,0,,27367477,,,4
69,H5,2019,2019,2019,2,0,2,Export,40,Austria,AUT,203,Czechia,CZE,,,,,,,,71,"Natural, cultured pearls; precious, semi-precious stones; precious metals, metals clad with precious metal, and articles thereof; imitation jewellery; coin",1,No Quantity,,,0,,0,,125199991,,,4
70,H5,2019,2019,2019,2,0,2,Export,40,Austria,AUT,203,Czechia,CZE,,,,,,,,72,Iron and steel,1,No Quantity,,,0,,0,,355236843,,,4
71,H5,2019,2019,2019,2,0,2,Export,40,Austria,AUT,203,Czechia,CZE,,,,,,,,73,Iron or steel articles,1,No Quantity,,,0,,0,,232247772,,,0
72,H5,2019,2019,2019,2,0,2,Export,40,Austria,AUT,203,Czechia,CZE,,,,,,,,74,Copper and articles thereof,1,No Quantity,,,0,,0,,25260384,,,0
73,H5,2019,2019,2019,2,0,2,Export,40,Austria,AUT,203,Czechia,CZE,,,,,,,,75,Nickel and articles thereof,1,No Quantity,,,0,,0,,893311,,,0
74,H5,2019,2019,2019,2,0,2,Export,40,Austria,AUT,203,Czechia,CZE,,,,,,,,76,Aluminium and articles thereof,1,No Quantity,,,0,,0,,135899321,,,0
75,H5,2019,2019,2019,2,0,2,Export,40,Austria,AUT,203,Czechia,CZE,,,,,,,,78,Lead and articles thereof,1,No Quantity,,,0,,0,,10838850,,,0
76,H5,2019,2019,2019,2,0,2,Export,40,Austria,AUT,203,Czechia,CZE,,,,,,,,79,Zinc and articles thereof,1,No Quantity,,,0,,0,,17388073,,,0
77,H5,2019,2019,2019,2,0,2,Export,40,Austria,AUT,203,Czechia,CZE,,,,,,,,80,Tin; articles thereof,1,No Quantity,,,0,,0,,139630,,,0
78,H5,2019,2019,2019,2,0,2,Export,40,Austria,AUT,203,Czechia,CZE,,,,,,,,81,"Metals; n.e.c., cermets and articles thereof",1,No Quantity,,,0,,0,,5652626,,,0
79,H5,2019,2019,2019,2,0,2,Export,40,Austria,AUT,203,Czechia,CZE,,,,,,,,82,"Tools, implements, cutlery, spoons and forks, of base metal; parts thereof, of base metal",1,No Quantity,,,0,,0,,35099745,,,0
80,H5,2019,2019,2019,2,0,2,Export,40,Austria,AUT,203,Czechia,CZE,,,,,,,,83,Metal; miscellaneous products of base metal,1,No Quantity,,,0,,0,,69252669,,,0
81,H5,2019,2019,2019,2,0,2,Export,40,Austria,AUT,203,Czechia,CZE,,,,,,,,84,"Nuclear reactors, boilers, machinery and mechanical appliances; parts thereof",1,No Quantity,,,0,,0,,733772769,,,0
82,H5,2019,2019,2019,2,0,2,Export,40,Austria,AUT,203,Czechia,CZE,,,,,,,,85,"Electrical machinery and equipment and parts thereof; sound recorders and reproducers; television image and sound recorders and reproducers, parts and accessories of such articles",1,No Quantity,,,0,,0,,832595525,,,4
83,H5,2019,2019,2019,2,0,2,Export,40,Austria,AUT,203,Czechia,CZE,,,,,,,,86,"Railway, tramway locomotives, rolling-stock and parts thereof; railway or tramway track fixtures and fittings and parts thereof; mechanical (including electro-mechanical) traffic signalling equipment of all kinds",1,No Quantity,,,0,,0,,47173622,,,0
84,H5,2019,2019,2019,2,0,2,Export,40,Austria,AUT,203,Czechia,CZE,,,,,,,,87,"Vehicles; other than railway or tramway rolling stock, and parts and accessories thereof",1,No Quantity,,,0,,0,,787497291,,,0
85,H5,2019,2019,2019,2,0,2,Export,40,Austria,AUT,203,Czechia,CZE,,,,,,,,88,"Aircraft, spacecraft and parts thereof",1,No Quantity,,,0,,0,,13545254,,,0
86,H5,2019,2019,2019,2,0,2,Export,40,Austria,AUT,203,Czechia,CZE,,,,,,,,89,"Ships, boats and floating structures",1,No Quantity,,,0,,0,,198787,,,0
87,H5,2019,2019,2019,2,0,2,Export,40,Austria,AUT,203,Czechia,CZE,,,,,,,,90,"Optical, photographic, cinematographic, measuring, checking, medical or surgical instruments and apparatus; parts and accessories",1,No Quantity,,,0,,0,,117821654,,,4
88,H5,2019,2019,2019,2,0,2,Export,40,Austria,AUT,203,Czechia,CZE,,,,,,,,91,Clocks and watches and parts thereof,1,No Quantity,,,0,,0,,7144915,,,4
89,H5,2019,2019,2019,2,0,2,Export,40,Austria,AUT,203,Czechia,CZE,,,,,,,,92,Musical instruments; parts and accessories of such articles,1,No Quantity,,,0,,0,,357037,,,0
90,H5,2019,2019,2019,2,0,2,Export,40,Austria,AUT,203,Czechia,CZE,,,,,,,,93,Arms and ammunition; parts and accessories thereof,1,No Quantity,,,0,,0,,2241520,,,0
91,H5,2019,2019,2019,2,0,2,Export,40,Austria,AUT,203,Czechia,CZE,,,,,,,,94,"Furniture; bedding, mattresses, mattress supports, cushions and similar stuffed furnishings; lamps and lighting fittings, n.e.c.; illuminated signs, illuminated name-plates and the like; prefabricated buildings",1,No Quantity,,,0,,0,,70011116,,,0
92,H5,2019,2019,2019,2,0,2,Export,40,Austria,AUT,203,Czechia,CZE,,,,,,,,95,"Toys, games and sports requisites; parts and accessories thereof",1,No Quantity,,,0,,0,,72833350,,,0
93,H5,2019,2019,2019,2,0,2,Export,40,Austria,AUT,203,Czechia,CZE,,,,,,,,96,Miscellaneous manufactured articles,1,No Quantity,,,0,,0,,9448111,,,0
94,H5,2019,2019,2019,2,0,2,Export,40,Austria,AUT,203,Czechia,CZE,,,,,,,,97,Works of art; collectors' pieces and antiques,1,No Quantity,,,0,,0,,876197,,,4
95,H5,2019,2019,2019,2,0,2,Export,40,Austria,AUT,203,Czechia,CZE,,,,,,,,99,Commodities not specified according to kind,1,No Quantity,,,0,,0,,400920,,,0
