,pfCode,yr,period,periodDesc,aggrLevel,IsLeaf,rgCode,rgDesc,rtCode,rtTitle,rt3ISO,ptCode,ptTitle,pt3ISO,ptCode2,ptTitle2,pt3ISO2,cstCode,cstDesc,motCode,motDesc,cmdCode,cmdDescE,qtCode,qtDesc,qtAltCode,qtAltDesc,TradeQuantity,AltQuantity,NetWeight,GrossWeight,TradeValue,CIFValue,FOBValue,estCode
0,H5,2019,2019,2019,2,0,2,Export,40,Austria,AUT,440,Lithuania,LTU,,,,,,,,02,Meat and edible meat offal,1,No Quantity,,,0,,0,,259305,,,0
1,H5,2019,2019,2019,2,0,2,Export,40,Austria,AUT,440,Lithuania,LTU,,,,,,,,03,"Fish and crustaceans, molluscs and other aquatic invertebrates",1,No Quantity,,,0,,0,,4,,,4
2,H5,2019,2019,2019,2,0,2,Export,40,Austria,AUT,440,Lithuania,LTU,,,,,,,,04,"Dairy produce; birds' eggs; natural honey; edible products of animal origin, not elsewhere specified or included",1,No Quantity,,,0,,0,,63976,,,0
3,H5,2019,2019,2019,2,0,2,Export,40,Austria,AUT,440,Lithuania,LTU,,,,,,,,05,Animal originated products; not elsewhere specified or included,1,No Quantity,,,0,,0,,7400,,,4
4,H5,2019,2019,2019,2,0,2,Export,40,Austria,AUT,440,Lithuania,LTU,,,,,,,,07,Vegetables and certain roots and tubers; edible,1,No Quantity,,,0,,0,,93237,,,4
5,H5,2019,2019,2019,2,0,2,Export,40,Austria,AUT,440,Lithuania,LTU,,,,,,,,08,"Fruit and nuts, edible; peel of citrus fruit or melons",1,No Quantity,,,0,,0,,254467,,,4
6,H5,2019,2019,2019,2,0,2,Export,40,Austria,AUT,440,Lithuania,LTU,,,,,,,,09,"Coffee, tea, mate and spices",1,No Quantity,,,0,,0,,300852,,,4
7,H5,2019,2019,2019,2,0,2,Export,40,Austria,AUT,440,Lithuania,LTU,,,,,,,,10,Cereals,1,No Quantity,,,0,,0,,1370560,,,0
8,H5,2019,2019,2019,2,0,2,Export,40,Austria,AUT,440,Lithuania,LTU,,,,,,,,11,"Products of the milling industry; malt, starches, inulin, wheat gluten",1,No Quantity,,,0,,0,,721734,,,0
9,H5,2019,2019,2019,2,0,2,Export,40,Austria,AUT,440,Lithuania,LTU,,,,,,,,12,"Oil seeds and oleaginous fruits; miscellaneous grains, seeds and fruit, industrial or medicinal plants; straw and fodder",1,No Quantity,,,0,,0,,715805,,,0
10,H5,2019,2019,2019,2,0,2,Export,40,Austria,AUT,440,Lithuania,LTU,,,,,,,,13,"Lac; gums, resins and other vegetable saps and extracts",1,No Quantity,,,0,,0,,6243,,,0
11,H5,2019,2019,2019,2,0,2,Export,40,Austria,AUT,440,Lithuania,LTU,,,,,,,,15,Animal or vegetable fats and oils and their cleavage products; prepared animal fats; animal or vegetable waxes,1,No Quantity,,,0,,0,,1144180,,,4
12,H5,2019,2019,2019,2,0,2,Export,40,Austria,AUT,440,Lithuania,LTU,,,,,,,,16,"Meat, fish or crustaceans, molluscs or other aquatic invertebrates; preparations thereof",1,No Quantity,,,0,,0,,1013372,,,0
13,H5,2019,2019,2019,2,0,2,Export,40,Austria,AUT,440,Lithuania,LTU,,,,,,,,17,Sugars and sugar confectionery,1,No Quantity,,,0,,0,,49285,,,0
14,H5,2019,2019,2019,2,0,2,Export,40,Austria,AUT,440,Lithuania,LTU,,,,,,,,18,Cocoa and cocoa preparations,1,No Quantity,,,0,,0,,2492254,,,0
15,H5,2019,2019,2019,2,0,2,Export,40,Austria,AUT,440,Lithuania,LTU,,,,,,,,19,"Preparations of cereals, flour, starch or milk; pastrycooks' products",1,No Quantity,,,0,,0,,3234911,,,0
16,H5,2019,2019,2019,2,0,2,Export,40,Austria,AUT,440,Lithuania,LTU,,,,,,,,20,"Preparations of vegetables, fruit, nuts or other parts of plants",1,No Quantity,,,0,,0,,1400614,,,0
17,H5,2019,2019,2019,2,0,2,Export,40,Austria,AUT,440,Lithuania,LTU,,,,,,,,21,Miscellaneous edible preparations,1,No Quantity,,,0,,0,,2270939,,,0
18,H5,2019,2019,2019,2,0,2,Export,40,Austria,AUT,440,Lithuania,LTU,,,,,,,,22,"Beverages, spirits and vinegar",1,No Quantity,,,0,,0,,4532435,,,0
19,H5,2019,2019,2019,2,0,2,Export,40,Austria,AUT,440,Lithuania,LTU,,,,,,,,23,"Food industries, residues and wastes thereof; prepared animal fodder",1,No Quantity,,,0,,0,,1761286,,,0
20,H5,2019,2019,2019,2,0,2,Export,40,Austria,AUT,440,Lithuania,LTU,,,,,,,,25,"Salt; sulphur; earths, stone; plastering materials, lime and cement",1,No Quantity,,,0,,0,,334315,,,0
21,H5,2019,2019,2019,2,0,2,Export,40,Austria,AUT,440,Lithuania,LTU,,,,,,,,27,"Mineral fuels, mineral oils and products of their distillation; bituminous substances; mineral waxes",1,No Quantity,,,0,,0,,545850,,,4
22,H5,2019,2019,2019,2,0,2,Export,40,Austria,AUT,440,Lithuania,LTU,,,,,,,,28,"Inorganic chemicals; organic and inorganic compounds of precious metals; of rare earth metals, of radio-active elements and of isotopes",1,No Quantity,,,0,,0,,322229,,,4
23,H5,2019,2019,2019,2,0,2,Export,40,Austria,AUT,440,Lithuania,LTU,,,,,,,,29,Organic chemicals,1,No Quantity,,,0,,0,,710330,,,4
24,H5,2019,2019,2019,2,0,2,Export,40,Austria,AUT,440,Lithuania,LTU,,,,,,,,30,Pharmaceutical products,1,No Quantity,,,0,,0,,52350289,,,0
25,H5,2019,2019,2019,2,0,2,Export,40,Austria,AUT,440,Lithuania,LTU,,,,,,,,31,Fertilizers,1,No Quantity,,,0,,0,,218500,,,0
26,H5,2019,2019,2019,2,0,2,Export,40,Austria,AUT,440,Lithuania,LTU,,,,,,,,32,"Tanning or dyeing extracts; tannins and their derivatives; dyes, pigments and other colouring matter; paints, varnishes; putty, other mastics; inks",1,No Quantity,,,0,,0,,2029637,,,0
27,H5,2019,2019,2019,2,0,2,Export,40,Austria,AUT,440,Lithuania,LTU,,,,,,,,33,"Essential oils and resinoids; perfumery, cosmetic or toilet preparations",1,No Quantity,,,0,,0,,1233566,,,4
28,H5,2019,2019,2019,2,0,2,Export,40,Austria,AUT,440,Lithuania,LTU,,,,,,,,34,"Soap, organic surface-active agents; washing, lubricating, polishing or scouring preparations; artificial or prepared waxes, candles and similar articles, modelling pastes, dental waxes and dental preparations with a basis of plaster",1,No Quantity,,,0,,0,,2394468,,,0
29,H5,2019,2019,2019,2,0,2,Export,40,Austria,AUT,440,Lithuania,LTU,,,,,,,,35,Albuminoidal substances; modified starches; glues; enzymes,1,No Quantity,,,0,,0,,102640,,,0
30,H5,2019,2019,2019,2,0,2,Export,40,Austria,AUT,440,Lithuania,LTU,,,,,,,,36,Explosives; pyrotechnic products; matches; pyrophoric alloys; certain combustible preparations,1,No Quantity,,,0,,0,,1112,,,0
31,H5,2019,2019,2019,2,0,2,Export,40,Austria,AUT,440,Lithuania,LTU,,,,,,,,37,Photographic or cinematographic goods,1,No Quantity,,,0,,0,,4215,,,4
32,H5,2019,2019,2019,2,0,2,Export,40,Austria,AUT,440,Lithuania,LTU,,,,,,,,38,Chemical products n.e.c.,1,No Quantity,,,0,,0,,6340428,,,0
33,H5,2019,2019,2019,2,0,2,Export,40,Austria,AUT,440,Lithuania,LTU,,,,,,,,39,Plastics and articles thereof,1,No Quantity,,,0,,0,,28862994,,,4
34,H5,2019,2019,2019,2,0,2,Export,40,Austria,AUT,440,Lithuania,LTU,,,,,,,,40,Rubber and articles thereof,1,No Quantity,,,0,,0,,1987359,,,4
35,H5,2019,2019,2019,2,0,2,Export,40,Austria,AUT,440,Lithuania,LTU,,,,,,,,41,Raw hides and skins (other than furskins) and leather,1,No Quantity,,,0,,0,,696459,,,0
36,H5,2019,2019,2019,2,0,2,Export,40,Austria,AUT,440,Lithuania,LTU,,,,,,,,42,"Articles of leather; saddlery and harness; travel goods, handbags and similar containers; articles of animal gut (other than silk-worm gut)",1,No Quantity,,,0,,0,,300243,,,4
37,H5,2019,2019,2019,2,0,2,Export,40,Austria,AUT,440,Lithuania,LTU,,,,,,,,43,Furskins and artificial fur; manufactures thereof,1,No Quantity,,,0,,0,,1596,,,0
38,H5,2019,2019,2019,2,0,2,Export,40,Austria,AUT,440,Lithuania,LTU,,,,,,,,44,Wood and articles of wood; wood charcoal,1,No Quantity,,,0,,0,,4325103,,,0
39,H5,2019,2019,2019,2,0,2,Export,40,Austria,AUT,440,Lithuania,LTU,,,,,,,,45,Cork and articles of cork,1,No Quantity,,,0,,0,,108178,,,0
40,H5,2019,2019,2019,2,0,2,Export,40,Austria,AUT,440,Lithuania,LTU,,,,,,,,46,"Manufactures of straw, esparto or other plaiting materials; basketware and wickerwork",1,No Quantity,,,0,,0,,7,,,0
41,H5,2019,2019,2019,2,0,2,Export,40,Austria,AUT,440,Lithuania,LTU,,,,,,,,47,Pulp of wood or other fibrous cellulosic material; recovered (waste and scrap) paper or paperboard,1,No Quantity,,,0,,0,,37808,,,0
42,H5,2019,2019,2019,2,0,2,Export,40,Austria,AUT,440,Lithuania,LTU,,,,,,,,48,"Paper and paperboard; articles of paper pulp, of paper or paperboard",1,No Quantity,,,0,,0,,11484148,,,4
43,H5,2019,2019,2019,2,0,2,Export,40,Austria,AUT,440,Lithuania,LTU,,,,,,,,49,"Printed books, newspapers, pictures and other products of the printing industry; manuscripts, typescripts and plans",1,No Quantity,,,0,,0,,175205,,,0
44,H5,2019,2019,2019,2,0,2,Export,40,Austria,AUT,440,Lithuania,LTU,,,,,,,,51,"Wool, fine or coarse animal hair; horsehair yarn and woven fabric",1,No Quantity,,,0,,0,,1438123,,,0
45,H5,2019,2019,2019,2,0,2,Export,40,Austria,AUT,440,Lithuania,LTU,,,,,,,,52,Cotton,1,No Quantity,,,0,,0,,1375697,,,4
46,H5,2019,2019,2019,2,0,2,Export,40,Austria,AUT,440,Lithuania,LTU,,,,,,,,53,Vegetable textile fibres; paper yarn and woven fabrics of paper yarn,1,No Quantity,,,0,,0,,119993,,,0
47,H5,2019,2019,2019,2,0,2,Export,40,Austria,AUT,440,Lithuania,LTU,,,,,,,,54,Man-made filaments; strip and the like of man-made textile materials,1,No Quantity,,,0,,0,,279440,,,0
48,H5,2019,2019,2019,2,0,2,Export,40,Austria,AUT,440,Lithuania,LTU,,,,,,,,55,Man-made staple fibres,1,No Quantity,,,0,,0,,888783,,,0
49,H5,2019,2019,2019,2,0,2,Export,40,Austria,AUT,440,Lithuania,LTU,,,,,,,,56,"Wadding, felt and nonwovens, special yarns; twine, cordage, ropes and cables and articles thereof",1,No Quantity,,,0,,0,,381372,,,0
50,H5,2019,2019,2019,2,0,2,Export,40,Austria,AUT,440,Lithuania,LTU,,,,,,,,57,Carpets and other textile floor coverings,1,No Quantity,,,0,,0,,1209,,,0
51,H5,2019,2019,2019,2,0,2,Export,40,Austria,AUT,440,Lithuania,LTU,,,,,,,,58,"Fabrics; special woven fabrics, tufted textile fabrics, lace, tapestries, trimmings, embroidery",1,No Quantity,,,0,,0,,443800,,,4
52,H5,2019,2019,2019,2,0,2,Export,40,Austria,AUT,440,Lithuania,LTU,,,,,,,,59,"Textile fabrics; impregnated, coated, covered or laminated; textile articles of a kind suitable for industrial use",1,No Quantity,,,0,,0,,337561,,,0
53,H5,2019,2019,2019,2,0,2,Export,40,Austria,AUT,440,Lithuania,LTU,,,,,,,,60,Fabrics; knitted or crocheted,1,No Quantity,,,0,,0,,369048,,,0
54,H5,2019,2019,2019,2,0,2,Export,40,Austria,AUT,440,Lithuania,LTU,,,,,,,,61,Apparel and clothing accessories; knitted or crocheted,1,No Quantity,,,0,,0,,972668,,,4
55,H5,2019,2019,2019,2,0,2,Export,40,Austria,AUT,440,Lithuania,LTU,,,,,,,,62,Apparel and clothing accessories; not knitted or crocheted,1,No Quantity,,,0,,0,,467103,,,4
56,H5,2019,2019,2019,2,0,2,Export,40,Austria,AUT,440,Lithuania,LTU,,,,,,,,63,"Textiles, made up articles; sets; worn clothing and worn textile articles; rags",1,No Quantity,,,0,,0,,2749408,,,4
57,H5,2019,2019,2019,2,0,2,Export,40,Austria,AUT,440,Lithuania,LTU,,,,,,,,64,Footwear; gaiters and the like; parts of such articles,1,No Quantity,,,0,,0,,745521,,,0
58,H5,2019,2019,2019,2,0,2,Export,40,Austria,AUT,440,Lithuania,LTU,,,,,,,,65,Headgear and parts thereof,1,No Quantity,,,0,,0,,125022,,,4
59,H5,2019,2019,2019,2,0,2,Export,40,Austria,AUT,440,Lithuania,LTU,,,,,,,,66,"Umbrellas, sun umbrellas, walking-sticks, seat sticks, whips, riding crops; and parts thereof",1,No Quantity,,,0,,0,,180256,,,0
60,H5,2019,2019,2019,2,0,2,Export,40,Austria,AUT,440,Lithuania,LTU,,,,,,,,67,"Feathers and down, prepared; and articles made of feather or of down; artificial flowers; articles of human hair",1,No Quantity,,,0,,0,,1177,,,4
61,H5,2019,2019,2019,2,0,2,Export,40,Austria,AUT,440,Lithuania,LTU,,,,,,,,68,"Stone, plaster, cement, asbestos, mica or similar materials; articles thereof",1,No Quantity,,,0,,0,,882175,,,0
62,H5,2019,2019,2019,2,0,2,Export,40,Austria,AUT,440,Lithuania,LTU,,,,,,,,69,Ceramic products,1,No Quantity,,,0,,0,,355177,,,0
63,H5,2019,2019,2019,2,0,2,Export,40,Austria,AUT,440,Lithuania,LTU,,,,,,,,70,Glass and glassware,1,No Quantity,,,0,,0,,1812323,,,4
64,H5,2019,2019,2019,2,0,2,Export,40,Austria,AUT,440,Lithuania,LTU,,,,,,,,71,"Natural, cultured pearls; precious, semi-precious stones; precious metals, metals clad with precious metal, and articles thereof; imitation jewellery; coin",1,No Quantity,,,0,,0,,1153842,,,4
65,H5,2019,2019,2019,2,0,2,Export,40,Austria,AUT,440,Lithuania,LTU,,,,,,,,72,Iron and steel,1,No Quantity,,,0,,0,,293242,,,0
66,H5,2019,2019,2019,2,0,2,Export,40,Austria,AUT,440,Lithuania,LTU,,,,,,,,73,Iron or steel articles,1,No Quantity,,,0,,0,,13541441,,,4
67,H5,2019,2019,2019,2,0,2,Export,40,Austria,AUT,440,Lithuania,LTU,,,,,,,,74,Copper and articles thereof,1,No Quantity,,,0,,0,,373668,,,0
68,H5,2019,2019,2019,2,0,2,Export,40,Austria,AUT,440,Lithuania,LTU,,,,,,,,75,Nickel and articles thereof,1,No Quantity,,,0,,0,,450,,,0
69,H5,2019,2019,2019,2,0,2,Export,40,Austria,AUT,440,Lithuania,LTU,,,,,,,,76,Aluminium and articles thereof,1,No Quantity,,,0,,0,,2785328,,,0
70,H5,2019,2019,2019,2,0,2,Export,40,Austria,AUT,440,Lithuania,LTU,,,,,,,,78,Lead and articles thereof,1,No Quantity,,,0,,0,,1678,,,0
71,H5,2019,2019,2019,2,0,2,Export,40,Austria,AUT,440,Lithuania,LTU,,,,,,,,79,Zinc and articles thereof,1,No Quantity,,,0,,0,,825,,,0
72,H5,2019,2019,2019,2,0,2,Export,40,Austria,AUT,440,Lithuania,LTU,,,,,,,,81,"Metals; n.e.c., cermets and articles thereof",1,No Quantity,,,0,,0,,209392,,,0
73,H5,2019,2019,2019,2,0,2,Export,40,Austria,AUT,440,Lithuania,LTU,,,,,,,,82,"Tools, implements, cutlery, spoons and forks, of base metal; parts thereof, of base metal",1,No Quantity,,,0,,0,,1766357,,,0
74,H5,2019,2019,2019,2,0,2,Export,40,Austria,AUT,440,Lithuania,LTU,,,,,,,,83,Metal; miscellaneous products of base metal,1,No Quantity,,,0,,0,,10415936,,,4
75,H5,2019,2019,2019,2,0,2,Export,40,Austria,AUT,440,Lithuania,LTU,,,,,,,,84,"Nuclear reactors, boilers, machinery and mechanical appliances; parts thereof",1,No Quantity,,,0,,0,,49817848,,,4
76,H5,2019,2019,2019,2,0,2,Export,40,Austria,AUT,440,Lithuania,LTU,,,,,,,,85,"Electrical machinery and equipment and parts thereof; sound recorders and reproducers; television image and sound recorders and reproducers, parts and accessories of such articles",1,No Quantity,,,0,,0,,22305374,,,4
77,H5,2019,2019,2019,2,0,2,Export,40,Austria,AUT,440,Lithuania,LTU,,,,,,,,86,"Railway, tramway locomotives, rolling-stock and parts thereof; railway or tramway track fixtures and fittings and parts thereof; mechanical (including electro-mechanical) traffic signalling equipment of all kinds",1,No Quantity,,,0,,0,,71860,,,0
78,H5,2019,2019,2019,2,0,2,Export,40,Austria,AUT,440,Lithuania,LTU,,,,,,,,87,"Vehicles; other than railway or tramway rolling stock, and parts and accessories thereof",1,No Quantity,,,0,,0,,32196126,,,4
79,H5,2019,2019,2019,2,0,2,Export,40,Austria,AUT,440,Lithuania,LTU,,,,,,,,88,"Aircraft, spacecraft and parts thereof",1,No Quantity,,,0,,0,,10906,,,0
80,H5,2019,2019,2019,2,0,2,Export,40,Austria,AUT,440,Lithuania,LTU,,,,,,,,90,"Optical, photographic, cinematographic, measuring, checking, medical or surgical instruments and apparatus; parts and accessories",1,No Quantity,,,0,,0,,6150450,,,4
81,H5,2019,2019,2019,2,0,2,Export,40,Austria,AUT,440,Lithuania,LTU,,,,,,,,91,Clocks and watches and parts thereof,1,No Quantity,,,0,,0,,364623,,,4
82,H5,2019,2019,2019,2,0,2,Export,40,Austria,AUT,440,Lithuania,LTU,,,,,,,,92,Musical instruments; parts and accessories of such articles,1,No Quantity,,,0,,0,,63358,,,0
83,H5,2019,2019,2019,2,0,2,Export,40,Austria,AUT,440,Lithuania,LTU,,,,,,,,93,Arms and ammunition; parts and accessories thereof,1,No Quantity,,,0,,0,,1947850,,,0
84,H5,2019,2019,2019,2,0,2,Export,40,Austria,AUT,440,Lithuania,LTU,,,,,,,,94,"Furniture; bedding, mattresses, mattress supports, cushions and similar stuffed furnishings; lamps and lighting fittings, n.e.c.; illuminated signs, illuminated name-plates and the like; prefabricated buildings",1,No Quantity,,,0,,0,,2881031,,,0
85,H5,2019,2019,2019,2,0,2,Export,40,Austria,AUT,440,Lithuania,LTU,,,,,,,,95,"Toys, games and sports requisites; parts and accessories thereof",1,No Quantity,,,0,,0,,3358399,,,0
86,H5,2019,2019,2019,2,0,2,Export,40,Austria,AUT,440,Lithuania,LTU,,,,,,,,96,Miscellaneous manufactured articles,1,No Quantity,,,0,,0,,443976,,,4
87,H5,2019,2019,2019,2,0,2,Export,40,Austria,AUT,440,Lithuania,LTU,,,,,,,,97,Works of art; collectors' pieces and antiques,1,No Quantity,,,0,,0,,15277,,,4
88,H5,2019,2019,2019,2,0,2,Export,40,Austria,AUT,440,Lithuania,LTU,,,,,,,,99,Commodities not specified according to kind,1,No Quantity,,,0,,0,,17776,,,0
