,pfCode,yr,period,periodDesc,aggrLevel,IsLeaf,rgCode,rgDesc,rtCode,rtTitle,rt3ISO,ptCode,ptTitle,pt3ISO,ptCode2,ptTitle2,pt3ISO2,cstCode,cstDesc,motCode,motDesc,cmdCode,cmdDescE,qtCode,qtDesc,qtAltCode,qtAltDesc,TradeQuantity,AltQuantity,NetWeight,GrossWeight,TradeValue,CIFValue,FOBValue,estCode
0,H5,2019,2019,2019,2,0,2,Export,40,Austria,AUT,170,Colombia,COL,,,,,,,,04,"Dairy produce; birds' eggs; natural honey; edible products of animal origin, not elsewhere specified or included",1,No Quantity,,,0,,0,,42764,,,0
1,H5,2019,2019,2019,2,0,2,Export,40,Austria,AUT,170,Colombia,COL,,,,,,,,05,Animal originated products; not elsewhere specified or included,1,No Quantity,,,0,,0,,75297,,,0
2,H5,2019,2019,2019,2,0,2,Export,40,Austria,AUT,170,Colombia,COL,,,,,,,,09,"Coffee, tea, mate and spices",1,No Quantity,,,0,,0,,2,,,4
3,H5,2019,2019,2019,2,0,2,Export,40,Austria,AUT,170,Colombia,COL,,,,,,,,11,"Products of the milling industry; malt, starches, inulin, wheat gluten",1,No Quantity,,,0,,0,,74140,,,0
4,H5,2019,2019,2019,2,0,2,Export,40,Austria,AUT,170,Colombia,COL,,,,,,,,15,Animal or vegetable fats and oils and their cleavage products; prepared animal fats; animal or vegetable waxes,1,No Quantity,,,0,,0,,87,,,0
5,H5,2019,2019,2019,2,0,2,Export,40,Austria,AUT,170,Colombia,COL,,,,,,,,17,Sugars and sugar confectionery,1,No Quantity,,,0,,0,,208455,,,0
6,H5,2019,2019,2019,2,0,2,Export,40,Austria,AUT,170,Colombia,COL,,,,,,,,18,Cocoa and cocoa preparations,1,No Quantity,,,0,,0,,2,,,4
7,H5,2019,2019,2019,2,0,2,Export,40,Austria,AUT,170,Colombia,COL,,,,,,,,19,"Preparations of cereals, flour, starch or milk; pastrycooks' products",1,No Quantity,,,0,,0,,75040,,,4
8,H5,2019,2019,2019,2,0,2,Export,40,Austria,AUT,170,Colombia,COL,,,,,,,,20,"Preparations of vegetables, fruit, nuts or other parts of plants",1,No Quantity,,,0,,0,,7454,,,4
9,H5,2019,2019,2019,2,0,2,Export,40,Austria,AUT,170,Colombia,COL,,,,,,,,21,Miscellaneous edible preparations,1,No Quantity,,,0,,0,,317584,,,0
10,H5,2019,2019,2019,2,0,2,Export,40,Austria,AUT,170,Colombia,COL,,,,,,,,22,"Beverages, spirits and vinegar",1,No Quantity,,,0,,0,,2195525,,,4
11,H5,2019,2019,2019,2,0,2,Export,40,Austria,AUT,170,Colombia,COL,,,,,,,,23,"Food industries, residues and wastes thereof; prepared animal fodder",1,No Quantity,,,0,,0,,969298,,,0
12,H5,2019,2019,2019,2,0,2,Export,40,Austria,AUT,170,Colombia,COL,,,,,,,,25,"Salt; sulphur; earths, stone; plastering materials, lime and cement",1,No Quantity,,,0,,0,,659,,,0
13,H5,2019,2019,2019,2,0,2,Export,40,Austria,AUT,170,Colombia,COL,,,,,,,,27,"Mineral fuels, mineral oils and products of their distillation; bituminous substances; mineral waxes",1,No Quantity,,,0,,0,,14428,,,0
14,H5,2019,2019,2019,2,0,2,Export,40,Austria,AUT,170,Colombia,COL,,,,,,,,28,"Inorganic chemicals; organic and inorganic compounds of precious metals; of rare earth metals, of radio-active elements and of isotopes",1,No Quantity,,,0,,0,,966235,,,0
15,H5,2019,2019,2019,2,0,2,Export,40,Austria,AUT,170,Colombia,COL,,,,,,,,29,Organic chemicals,1,No Quantity,,,0,,0,,1256861,,,4
16,H5,2019,2019,2019,2,0,2,Export,40,Austria,AUT,170,Colombia,COL,,,,,,,,30,Pharmaceutical products,1,No Quantity,,,0,,0,,24688926,,,0
17,H5,2019,2019,2019,2,0,2,Export,40,Austria,AUT,170,Colombia,COL,,,,,,,,31,Fertilizers,1,No Quantity,,,0,,0,,44,,,0
18,H5,2019,2019,2019,2,0,2,Export,40,Austria,AUT,170,Colombia,COL,,,,,,,,32,"Tanning or dyeing extracts; tannins and their derivatives; dyes, pigments and other colouring matter; paints, varnishes; putty, other mastics; inks",1,No Quantity,,,0,,0,,1500492,,,4
19,H5,2019,2019,2019,2,0,2,Export,40,Austria,AUT,170,Colombia,COL,,,,,,,,33,"Essential oils and resinoids; perfumery, cosmetic or toilet preparations",1,No Quantity,,,0,,0,,145834,,,4
20,H5,2019,2019,2019,2,0,2,Export,40,Austria,AUT,170,Colombia,COL,,,,,,,,34,"Soap, organic surface-active agents; washing, lubricating, polishing or scouring preparations; artificial or prepared waxes, candles and similar articles, modelling pastes, dental waxes and dental preparations with a basis of plaster",1,No Quantity,,,0,,0,,158822,,,4
21,H5,2019,2019,2019,2,0,2,Export,40,Austria,AUT,170,Colombia,COL,,,,,,,,35,Albuminoidal substances; modified starches; glues; enzymes,1,No Quantity,,,0,,0,,990,,,4
22,H5,2019,2019,2019,2,0,2,Export,40,Austria,AUT,170,Colombia,COL,,,,,,,,37,Photographic or cinematographic goods,1,No Quantity,,,0,,0,,2980,,,4
23,H5,2019,2019,2019,2,0,2,Export,40,Austria,AUT,170,Colombia,COL,,,,,,,,38,Chemical products n.e.c.,1,No Quantity,,,0,,0,,5855255,,,4
24,H5,2019,2019,2019,2,0,2,Export,40,Austria,AUT,170,Colombia,COL,,,,,,,,39,Plastics and articles thereof,1,No Quantity,,,0,,0,,4949913,,,4
25,H5,2019,2019,2019,2,0,2,Export,40,Austria,AUT,170,Colombia,COL,,,,,,,,40,Rubber and articles thereof,1,No Quantity,,,0,,0,,303546,,,4
26,H5,2019,2019,2019,2,0,2,Export,40,Austria,AUT,170,Colombia,COL,,,,,,,,41,Raw hides and skins (other than furskins) and leather,1,No Quantity,,,0,,0,,95,,,0
27,H5,2019,2019,2019,2,0,2,Export,40,Austria,AUT,170,Colombia,COL,,,,,,,,42,"Articles of leather; saddlery and harness; travel goods, handbags and similar containers; articles of animal gut (other than silk-worm gut)",1,No Quantity,,,0,,0,,55631,,,0
28,H5,2019,2019,2019,2,0,2,Export,40,Austria,AUT,170,Colombia,COL,,,,,,,,44,Wood and articles of wood; wood charcoal,1,No Quantity,,,0,,0,,2700739,,,4
29,H5,2019,2019,2019,2,0,2,Export,40,Austria,AUT,170,Colombia,COL,,,,,,,,48,"Paper and paperboard; articles of paper pulp, of paper or paperboard",1,No Quantity,,,0,,0,,11299147,,,4
30,H5,2019,2019,2019,2,0,2,Export,40,Austria,AUT,170,Colombia,COL,,,,,,,,49,"Printed books, newspapers, pictures and other products of the printing industry; manuscripts, typescripts and plans",1,No Quantity,,,0,,0,,348350,,,4
31,H5,2019,2019,2019,2,0,2,Export,40,Austria,AUT,170,Colombia,COL,,,,,,,,55,Man-made staple fibres,1,No Quantity,,,0,,0,,119818,,,0
32,H5,2019,2019,2019,2,0,2,Export,40,Austria,AUT,170,Colombia,COL,,,,,,,,56,"Wadding, felt and nonwovens, special yarns; twine, cordage, ropes and cables and articles thereof",1,No Quantity,,,0,,0,,56408,,,4
33,H5,2019,2019,2019,2,0,2,Export,40,Austria,AUT,170,Colombia,COL,,,,,,,,57,Carpets and other textile floor coverings,1,No Quantity,,,0,,0,,122,,,4
34,H5,2019,2019,2019,2,0,2,Export,40,Austria,AUT,170,Colombia,COL,,,,,,,,58,"Fabrics; special woven fabrics, tufted textile fabrics, lace, tapestries, trimmings, embroidery",1,No Quantity,,,0,,0,,48624,,,4
35,H5,2019,2019,2019,2,0,2,Export,40,Austria,AUT,170,Colombia,COL,,,,,,,,59,"Textile fabrics; impregnated, coated, covered or laminated; textile articles of a kind suitable for industrial use",1,No Quantity,,,0,,0,,295976,,,4
36,H5,2019,2019,2019,2,0,2,Export,40,Austria,AUT,170,Colombia,COL,,,,,,,,61,Apparel and clothing accessories; knitted or crocheted,1,No Quantity,,,0,,0,,49777,,,4
37,H5,2019,2019,2019,2,0,2,Export,40,Austria,AUT,170,Colombia,COL,,,,,,,,62,Apparel and clothing accessories; not knitted or crocheted,1,No Quantity,,,0,,0,,172727,,,4
38,H5,2019,2019,2019,2,0,2,Export,40,Austria,AUT,170,Colombia,COL,,,,,,,,63,"Textiles, made up articles; sets; worn clothing and worn textile articles; rags",1,No Quantity,,,0,,0,,13124,,,0
39,H5,2019,2019,2019,2,0,2,Export,40,Austria,AUT,170,Colombia,COL,,,,,,,,64,Footwear; gaiters and the like; parts of such articles,1,No Quantity,,,0,,0,,86028,,,4
40,H5,2019,2019,2019,2,0,2,Export,40,Austria,AUT,170,Colombia,COL,,,,,,,,65,Headgear and parts thereof,1,No Quantity,,,0,,0,,48137,,,4
41,H5,2019,2019,2019,2,0,2,Export,40,Austria,AUT,170,Colombia,COL,,,,,,,,66,"Umbrellas, sun umbrellas, walking-sticks, seat sticks, whips, riding crops; and parts thereof",1,No Quantity,,,0,,0,,3578,,,0
42,H5,2019,2019,2019,2,0,2,Export,40,Austria,AUT,170,Colombia,COL,,,,,,,,68,"Stone, plaster, cement, asbestos, mica or similar materials; articles thereof",1,No Quantity,,,0,,0,,806721,,,4
43,H5,2019,2019,2019,2,0,2,Export,40,Austria,AUT,170,Colombia,COL,,,,,,,,69,Ceramic products,1,No Quantity,,,0,,0,,2195756,,,4
44,H5,2019,2019,2019,2,0,2,Export,40,Austria,AUT,170,Colombia,COL,,,,,,,,70,Glass and glassware,1,No Quantity,,,0,,0,,1272156,,,0
45,H5,2019,2019,2019,2,0,2,Export,40,Austria,AUT,170,Colombia,COL,,,,,,,,71,"Natural, cultured pearls; precious, semi-precious stones; precious metals, metals clad with precious metal, and articles thereof; imitation jewellery; coin",1,No Quantity,,,0,,0,,262045,,,4
46,H5,2019,2019,2019,2,0,2,Export,40,Austria,AUT,170,Colombia,COL,,,,,,,,72,Iron and steel,1,No Quantity,,,0,,0,,1353160,,,4
47,H5,2019,2019,2019,2,0,2,Export,40,Austria,AUT,170,Colombia,COL,,,,,,,,73,Iron or steel articles,1,No Quantity,,,0,,0,,5990367,,,4
48,H5,2019,2019,2019,2,0,2,Export,40,Austria,AUT,170,Colombia,COL,,,,,,,,74,Copper and articles thereof,1,No Quantity,,,0,,0,,12170,,,4
49,H5,2019,2019,2019,2,0,2,Export,40,Austria,AUT,170,Colombia,COL,,,,,,,,75,Nickel and articles thereof,1,No Quantity,,,0,,0,,5,,,4
50,H5,2019,2019,2019,2,0,2,Export,40,Austria,AUT,170,Colombia,COL,,,,,,,,76,Aluminium and articles thereof,1,No Quantity,,,0,,0,,3829890,,,4
51,H5,2019,2019,2019,2,0,2,Export,40,Austria,AUT,170,Colombia,COL,,,,,,,,78,Lead and articles thereof,1,No Quantity,,,0,,0,,24,,,4
52,H5,2019,2019,2019,2,0,2,Export,40,Austria,AUT,170,Colombia,COL,,,,,,,,80,Tin; articles thereof,1,No Quantity,,,0,,0,,99,,,4
53,H5,2019,2019,2019,2,0,2,Export,40,Austria,AUT,170,Colombia,COL,,,,,,,,81,"Metals; n.e.c., cermets and articles thereof",1,No Quantity,,,0,,0,,14462,,,0
54,H5,2019,2019,2019,2,0,2,Export,40,Austria,AUT,170,Colombia,COL,,,,,,,,82,"Tools, implements, cutlery, spoons and forks, of base metal; parts thereof, of base metal",1,No Quantity,,,0,,0,,616926,,,4
55,H5,2019,2019,2019,2,0,2,Export,40,Austria,AUT,170,Colombia,COL,,,,,,,,83,Metal; miscellaneous products of base metal,1,No Quantity,,,0,,0,,830794,,,4
56,H5,2019,2019,2019,2,0,2,Export,40,Austria,AUT,170,Colombia,COL,,,,,,,,84,"Nuclear reactors, boilers, machinery and mechanical appliances; parts thereof",1,No Quantity,,,0,,0,,32454208,,,4
57,H5,2019,2019,2019,2,0,2,Export,40,Austria,AUT,170,Colombia,COL,,,,,,,,85,"Electrical machinery and equipment and parts thereof; sound recorders and reproducers; television image and sound recorders and reproducers, parts and accessories of such articles",1,No Quantity,,,0,,0,,8774826,,,4
58,H5,2019,2019,2019,2,0,2,Export,40,Austria,AUT,170,Colombia,COL,,,,,,,,86,"Railway, tramway locomotives, rolling-stock and parts thereof; railway or tramway track fixtures and fittings and parts thereof; mechanical (including electro-mechanical) traffic signalling equipment of all kinds",1,No Quantity,,,0,,0,,329365,,,0
59,H5,2019,2019,2019,2,0,2,Export,40,Austria,AUT,170,Colombia,COL,,,,,,,,87,"Vehicles; other than railway or tramway rolling stock, and parts and accessories thereof",1,No Quantity,,,0,,0,,10732011,,,0
60,H5,2019,2019,2019,2,0,2,Export,40,Austria,AUT,170,Colombia,COL,,,,,,,,88,"Aircraft, spacecraft and parts thereof",1,No Quantity,,,0,,0,,35822,,,0
61,H5,2019,2019,2019,2,0,2,Export,40,Austria,AUT,170,Colombia,COL,,,,,,,,90,"Optical, photographic, cinematographic, measuring, checking, medical or surgical instruments and apparatus; parts and accessories",1,No Quantity,,,0,,0,,8490750,,,4
62,H5,2019,2019,2019,2,0,2,Export,40,Austria,AUT,170,Colombia,COL,,,,,,,,91,Clocks and watches and parts thereof,1,No Quantity,,,0,,0,,86015,,,0
63,H5,2019,2019,2019,2,0,2,Export,40,Austria,AUT,170,Colombia,COL,,,,,,,,92,Musical instruments; parts and accessories of such articles,1,No Quantity,,,0,,0,,141149,,,0
64,H5,2019,2019,2019,2,0,2,Export,40,Austria,AUT,170,Colombia,COL,,,,,,,,94,"Furniture; bedding, mattresses, mattress supports, cushions and similar stuffed furnishings; lamps and lighting fittings, n.e.c.; illuminated signs, illuminated name-plates and the like; prefabricated buildings",1,No Quantity,,,0,,0,,142647,,,4
65,H5,2019,2019,2019,2,0,2,Export,40,Austria,AUT,170,Colombia,COL,,,,,,,,95,"Toys, games and sports requisites; parts and accessories thereof",1,No Quantity,,,0,,0,,4889144,,,4
66,H5,2019,2019,2019,2,0,2,Export,40,Austria,AUT,170,Colombia,COL,,,,,,,,96,Miscellaneous manufactured articles,1,No Quantity,,,0,,0,,436552,,,4
