,pfCode,yr,period,periodDesc,aggrLevel,IsLeaf,rgCode,rgDesc,rtCode,rtTitle,rt3ISO,ptCode,ptTitle,pt3ISO,ptCode2,ptTitle2,pt3ISO2,cstCode,cstDesc,motCode,motDesc,cmdCode,cmdDescE,qtCode,qtDesc,qtAltCode,qtAltDesc,TradeQuantity,AltQuantity,NetWeight,GrossWeight,TradeValue,CIFValue,FOBValue,estCode
0,H5,2019,2019,2019,2,0,2,Export,40,Austria,AUT,231,Ethiopia,ETH,,,,,,,,15,Animal or vegetable fats and oils and their cleavage products; prepared animal fats; animal or vegetable waxes,1,No Quantity,,,0,,0,,96,,,0
1,H5,2019,2019,2019,2,0,2,Export,40,Austria,AUT,231,Ethiopia,ETH,,,,,,,,19,"Preparations of cereals, flour, starch or milk; pastrycooks' products",1,No Quantity,,,0,,0,,186,,,0
2,H5,2019,2019,2019,2,0,2,Export,40,Austria,AUT,231,Ethiopia,ETH,,,,,,,,20,"Preparations of vegetables, fruit, nuts or other parts of plants",1,No Quantity,,,0,,0,,7985,,,0
3,H5,2019,2019,2019,2,0,2,Export,40,Austria,AUT,231,Ethiopia,ETH,,,,,,,,21,Miscellaneous edible preparations,1,No Quantity,,,0,,0,,3269,,,0
4,H5,2019,2019,2019,2,0,2,Export,40,Austria,AUT,231,Ethiopia,ETH,,,,,,,,22,"Beverages, spirits and vinegar",1,No Quantity,,,0,,0,,348440,,,0
5,H5,2019,2019,2019,2,0,2,Export,40,Austria,AUT,231,Ethiopia,ETH,,,,,,,,27,"Mineral fuels, mineral oils and products of their distillation; bituminous substances; mineral waxes",1,No Quantity,,,0,,0,,71,,,0
6,H5,2019,2019,2019,2,0,2,Export,40,Austria,AUT,231,Ethiopia,ETH,,,,,,,,28,"Inorganic chemicals; organic and inorganic compounds of precious metals; of rare earth metals, of radio-active elements and of isotopes",1,No Quantity,,,0,,0,,3166,,,0
7,H5,2019,2019,2019,2,0,2,Export,40,Austria,AUT,231,Ethiopia,ETH,,,,,,,,29,Organic chemicals,1,No Quantity,,,0,,0,,13671,,,0
8,H5,2019,2019,2019,2,0,2,Export,40,Austria,AUT,231,Ethiopia,ETH,,,,,,,,30,Pharmaceutical products,1,No Quantity,,,0,,0,,174970,,,4
9,H5,2019,2019,2019,2,0,2,Export,40,Austria,AUT,231,Ethiopia,ETH,,,,,,,,32,"Tanning or dyeing extracts; tannins and their derivatives; dyes, pigments and other colouring matter; paints, varnishes; putty, other mastics; inks",1,No Quantity,,,0,,0,,4176,,,0
10,H5,2019,2019,2019,2,0,2,Export,40,Austria,AUT,231,Ethiopia,ETH,,,,,,,,33,"Essential oils and resinoids; perfumery, cosmetic or toilet preparations",1,No Quantity,,,0,,0,,45,,,4
11,H5,2019,2019,2019,2,0,2,Export,40,Austria,AUT,231,Ethiopia,ETH,,,,,,,,34,"Soap, organic surface-active agents; washing, lubricating, polishing or scouring preparations; artificial or prepared waxes, candles and similar articles, modelling pastes, dental waxes and dental preparations with a basis of plaster",1,No Quantity,,,0,,0,,6298,,,0
12,H5,2019,2019,2019,2,0,2,Export,40,Austria,AUT,231,Ethiopia,ETH,,,,,,,,35,Albuminoidal substances; modified starches; glues; enzymes,1,No Quantity,,,0,,0,,6754,,,0
13,H5,2019,2019,2019,2,0,2,Export,40,Austria,AUT,231,Ethiopia,ETH,,,,,,,,38,Chemical products n.e.c.,1,No Quantity,,,0,,0,,269297,,,0
14,H5,2019,2019,2019,2,0,2,Export,40,Austria,AUT,231,Ethiopia,ETH,,,,,,,,39,Plastics and articles thereof,1,No Quantity,,,0,,0,,107087,,,4
15,H5,2019,2019,2019,2,0,2,Export,40,Austria,AUT,231,Ethiopia,ETH,,,,,,,,40,Rubber and articles thereof,1,No Quantity,,,0,,0,,21634,,,4
16,H5,2019,2019,2019,2,0,2,Export,40,Austria,AUT,231,Ethiopia,ETH,,,,,,,,42,"Articles of leather; saddlery and harness; travel goods, handbags and similar containers; articles of animal gut (other than silk-worm gut)",1,No Quantity,,,0,,0,,356,,,4
17,H5,2019,2019,2019,2,0,2,Export,40,Austria,AUT,231,Ethiopia,ETH,,,,,,,,44,Wood and articles of wood; wood charcoal,1,No Quantity,,,0,,0,,2190468,,,0
18,H5,2019,2019,2019,2,0,2,Export,40,Austria,AUT,231,Ethiopia,ETH,,,,,,,,48,"Paper and paperboard; articles of paper pulp, of paper or paperboard",1,No Quantity,,,0,,0,,320787,,,0
19,H5,2019,2019,2019,2,0,2,Export,40,Austria,AUT,231,Ethiopia,ETH,,,,,,,,49,"Printed books, newspapers, pictures and other products of the printing industry; manuscripts, typescripts and plans",1,No Quantity,,,0,,0,,20300,,,0
20,H5,2019,2019,2019,2,0,2,Export,40,Austria,AUT,231,Ethiopia,ETH,,,,,,,,52,Cotton,1,No Quantity,,,0,,0,,71,,,0
21,H5,2019,2019,2019,2,0,2,Export,40,Austria,AUT,231,Ethiopia,ETH,,,,,,,,54,Man-made filaments; strip and the like of man-made textile materials,1,No Quantity,,,0,,0,,96,,,0
22,H5,2019,2019,2019,2,0,2,Export,40,Austria,AUT,231,Ethiopia,ETH,,,,,,,,56,"Wadding, felt and nonwovens, special yarns; twine, cordage, ropes and cables and articles thereof",1,No Quantity,,,0,,0,,20860,,,0
23,H5,2019,2019,2019,2,0,2,Export,40,Austria,AUT,231,Ethiopia,ETH,,,,,,,,59,"Textile fabrics; impregnated, coated, covered or laminated; textile articles of a kind suitable for industrial use",1,No Quantity,,,0,,0,,1824,,,0
24,H5,2019,2019,2019,2,0,2,Export,40,Austria,AUT,231,Ethiopia,ETH,,,,,,,,61,Apparel and clothing accessories; knitted or crocheted,1,No Quantity,,,0,,0,,373,,,4
25,H5,2019,2019,2019,2,0,2,Export,40,Austria,AUT,231,Ethiopia,ETH,,,,,,,,62,Apparel and clothing accessories; not knitted or crocheted,1,No Quantity,,,0,,0,,42754,,,0
26,H5,2019,2019,2019,2,0,2,Export,40,Austria,AUT,231,Ethiopia,ETH,,,,,,,,63,"Textiles, made up articles; sets; worn clothing and worn textile articles; rags",1,No Quantity,,,0,,0,,2603,,,0
27,H5,2019,2019,2019,2,0,2,Export,40,Austria,AUT,231,Ethiopia,ETH,,,,,,,,64,Footwear; gaiters and the like; parts of such articles,1,No Quantity,,,0,,0,,123,,,4
28,H5,2019,2019,2019,2,0,2,Export,40,Austria,AUT,231,Ethiopia,ETH,,,,,,,,68,"Stone, plaster, cement, asbestos, mica or similar materials; articles thereof",1,No Quantity,,,0,,0,,11550,,,4
29,H5,2019,2019,2019,2,0,2,Export,40,Austria,AUT,231,Ethiopia,ETH,,,,,,,,69,Ceramic products,1,No Quantity,,,0,,0,,1359351,,,0
30,H5,2019,2019,2019,2,0,2,Export,40,Austria,AUT,231,Ethiopia,ETH,,,,,,,,70,Glass and glassware,1,No Quantity,,,0,,0,,11615,,,0
31,H5,2019,2019,2019,2,0,2,Export,40,Austria,AUT,231,Ethiopia,ETH,,,,,,,,72,Iron and steel,1,No Quantity,,,0,,0,,98,,,0
32,H5,2019,2019,2019,2,0,2,Export,40,Austria,AUT,231,Ethiopia,ETH,,,,,,,,73,Iron or steel articles,1,No Quantity,,,0,,0,,84874,,,4
33,H5,2019,2019,2019,2,0,2,Export,40,Austria,AUT,231,Ethiopia,ETH,,,,,,,,74,Copper and articles thereof,1,No Quantity,,,0,,0,,50,,,4
34,H5,2019,2019,2019,2,0,2,Export,40,Austria,AUT,231,Ethiopia,ETH,,,,,,,,76,Aluminium and articles thereof,1,No Quantity,,,0,,0,,7145,,,4
35,H5,2019,2019,2019,2,0,2,Export,40,Austria,AUT,231,Ethiopia,ETH,,,,,,,,82,"Tools, implements, cutlery, spoons and forks, of base metal; parts thereof, of base metal",1,No Quantity,,,0,,0,,24956,,,0
36,H5,2019,2019,2019,2,0,2,Export,40,Austria,AUT,231,Ethiopia,ETH,,,,,,,,83,Metal; miscellaneous products of base metal,1,No Quantity,,,0,,0,,477209,,,4
37,H5,2019,2019,2019,2,0,2,Export,40,Austria,AUT,231,Ethiopia,ETH,,,,,,,,84,"Nuclear reactors, boilers, machinery and mechanical appliances; parts thereof",1,No Quantity,,,0,,0,,3809940,,,4
38,H5,2019,2019,2019,2,0,2,Export,40,Austria,AUT,231,Ethiopia,ETH,,,,,,,,85,"Electrical machinery and equipment and parts thereof; sound recorders and reproducers; television image and sound recorders and reproducers, parts and accessories of such articles",1,No Quantity,,,0,,0,,777270,,,4
39,H5,2019,2019,2019,2,0,2,Export,40,Austria,AUT,231,Ethiopia,ETH,,,,,,,,86,"Railway, tramway locomotives, rolling-stock and parts thereof; railway or tramway track fixtures and fittings and parts thereof; mechanical (including electro-mechanical) traffic signalling equipment of all kinds",1,No Quantity,,,0,,0,,21867,,,0
40,H5,2019,2019,2019,2,0,2,Export,40,Austria,AUT,231,Ethiopia,ETH,,,,,,,,87,"Vehicles; other than railway or tramway rolling stock, and parts and accessories thereof",1,No Quantity,,,0,,0,,884717,,,0
41,H5,2019,2019,2019,2,0,2,Export,40,Austria,AUT,231,Ethiopia,ETH,,,,,,,,88,"Aircraft, spacecraft and parts thereof",1,No Quantity,,,0,,0,,6435122,,,4
42,H5,2019,2019,2019,2,0,2,Export,40,Austria,AUT,231,Ethiopia,ETH,,,,,,,,90,"Optical, photographic, cinematographic, measuring, checking, medical or surgical instruments and apparatus; parts and accessories",1,No Quantity,,,0,,0,,870458,,,4
43,H5,2019,2019,2019,2,0,2,Export,40,Austria,AUT,231,Ethiopia,ETH,,,,,,,,94,"Furniture; bedding, mattresses, mattress supports, cushions and similar stuffed furnishings; lamps and lighting fittings, n.e.c.; illuminated signs, illuminated name-plates and the like; prefabricated buildings",1,No Quantity,,,0,,0,,122564,,,0
44,H5,2019,2019,2019,2,0,2,Export,40,Austria,AUT,231,Ethiopia,ETH,,,,,,,,95,"Toys, games and sports requisites; parts and accessories thereof",1,No Quantity,,,0,,0,,4538,,,0
45,H5,2019,2019,2019,2,0,2,Export,40,Austria,AUT,231,Ethiopia,ETH,,,,,,,,96,Miscellaneous manufactured articles,1,No Quantity,,,0,,0,,99328,,,0
